{
  "formatVersion": "1",
  "id": "https://plant.example/configurations/local-property-resolution",
  "version": "approved-local-1",
  "profile": {
    "id": "https://xregistry.io/workingdrafts/models/wot/profiles/tm-property-reference/1",
    "version": "1",
    "digest": "sha-256:2c83a8ae804ffc7159582045ae98c25d7f8fc4c69b8687d9dc1c01590a21be36"
  },
  "rules": [],
  "limits": {
    "maxDepth": 8,
    "maxBytes": 1048576,
    "maxMilliseconds": 5000
  }
}
